03292494,"OHIO RIVER AT WATER TOWER AT LOUISVILLE, KY",38.28118,-85.70219,NAD83,406.68,1,2013-11-13 10:15:00,2024-04-03 01:00:00,1,2013-11-28 14:00:00,2024-04-03 01:00:00,0514010106,Goose Creek-Ohio River,439.65
03292500,"SOUTH FORK BEARGRASS CREEK AT LOUISVILLE, KY",38.21146,-85.70246,NAD83,444.76,1,2007-10-01 01:00:00,2024-04-03 01:00:00,1,1988-06-01 00:00:00,2024-04-03 01:00:00,0514010109,Beargrass Creek-Ohio River,547.81
03292550,"S FK BEARGRASS CR AT WINTER AVE AT LOUISVILLE, KY",38.234516,-85.730515,NAD83,,0,,,1,1998-10-01 00:30:00,2010-09-30 23:45:00,0514010109,Beargrass Creek-Ohio River,547.81
03292557,"S FK BEARGRASS CR AT MASON AVE NR LOUISVILLE, KY",38.2415,-85.73688,NAD83,,1,2014-11-07 12:15:00,2017-01-04 08:15:00,0,,,0514010109,Beargrass Creek-Ohio River,547.81
03293000,"M FK BEARGRASS CR AT OLD CANNONS LN AT LOUISVILLE,",38.237293,-85.66468,NAD83,475.76,1,2007-10-01 01:00:00,2024-04-03 01:00:00,1,1987-10-01 00:15:00,2024-04-03 01:00:00,0514010109,Beargrass Creek-Ohio River,547.81
03293500,"M FK BEARGRASS CR AT LEXINGTON RD AT LOUISVILLE,KY",38.250347,-85.71663,NAD83,430.5,1,2007-10-01 01:00:00,2024-04-03 01:00:00,1,2003-07-01 00:00:00,2024-04-03 01:00:00,0514010109,Beargrass Creek-Ohio River,547.81
03293510,"BEARGRASS CREEK AT RIVER ROAD AT LOUISVILLE, KY",38.265903,-85.720795,NAD83,411.74,1,2008-01-15 12:00:00,2024-04-03 01:00:00,1,2008-03-12 00:00:00,2024-04-03 01:00:00,0514010109,Beargrass Creek-Ohio River,547.81
03293530,"MUDDY FK AT MOCKINGBIRD VALLEY RD AT LOUISVILLE,KY",38.27646,-85.69357,NAD83,424.05,1,2007-10-25 11:45:00,2024-04-03 01:00:00,1,2002-10-01 01:00:00,2024-04-03 01:00:00,0514010109,Beargrass Creek-Ohio River,547.81
03293551,"OHIO R US OF MCALPINE DAM @ RRB AT LOUISVILLE, KY",38.265903,-85.76885,NAD83,406.68,1,2008-03-03 12:58:00,2024-04-03 01:00:00,0,,,0514010109,Beargrass Creek-Ohio River,547.81
03294500,"OHIO RIVER AT LOUISVILLE, KY",38.280346,-85.79913,NAD83,373.18,1,2007-10-01 01:00:00,2024-04-03 01:00:00,1,2009-09-21 00:00:00,2024-04-03 01:00:00,0514010109,Beargrass Creek-Ohio River,547.81
03294550,"MILL CREEK CUTOFF NEAR LOUISVILLE, KY",38.17757,-85.866905,NAD83,413.92,1,2007-10-01 01:00:00,2024-04-03 01:00:00,1,1988-05-11 00:00:00,2024-04-03 01:00:00,0514010109,Beargrass Creek-Ohio River,547.81
03294560,"OHIO RIVER BELOW RIVERVIEW PK NR LOUISVILLE, KY",38.134712,-85.90123,NAD83,372.31,1,2022-09-01 17:15:00,2024-04-03 01:00:00,0,,,0514010109,Beargrass Creek-Ohio River,547.81
03294570,"MILL CREEK AT ORELL ROAD NEAR LOUISVILLE, KY",38.078125,-85.88996,NAD83,405.51,1,2007-10-01 01:00:00,2024-04-03 01:00:00,1,1999-08-01 00:00:00,2024-04-03 01:00:00,0514010109,Beargrass Creek-Ohio River,547.81
03294600,"OHIO RIVER AT KOSMOSDALE, KY",38.034794,-85.91413,NAD83,372.75,1,2007-10-01 01:00:00,2024-04-03 01:00:00,0,,,0514010109,Beargrass Creek-Ohio River,547.81
03295400,"SALT RIVER AT GLENSBORO, KY",38.002014,-85.06051,NAD83,584.52,1,2007-10-01 01:00:00,2024-04-03 01:00:00,1,1989-05-05 00:00:00,2024-04-03 01:00:00,0514010202,Crooked Creek-Salt River,168.24
03295597,"TAYLORSVILLE LAKE NEAR TAYLORSVILLE, KY",38.016453,-85.30773,NAD83,,1,2020-11-09 16:05:00,2024-04-03 01:00:00,0,,,0514010203,Beech Creek-Salt River,341.96
03295702,"BULLSKIN CREEK NEAR SIMPSONVILLE, KY",38.21868,-85.3019,NAD83,,0,,,1,1998-05-01 00:00:00,2007-09-30 23:45:00,0514010204,Bullskin Creek-Clear Creek,354.6
03295890,"BRASHEARS CREEK AT TAYLORSVILLE, KY",38.03701,-85.34079,NAD83,466.23,1,2007-10-01 01:00:00,2024-04-03 01:00:00,1,1987-10-01 01:00:00,2024-04-03 01:00:00,0514010205,Brashears Creek,324.36
03297800,"CEDAR CREEK AT HWY 1442 NEAR SHEPHERDSVILLE, KY",37.99111,-85.64111,NAD83,422.19,1,2007-10-01 01:00:00,2024-04-03 01:00:00,1,2002-04-27 00:00:00,2024-04-03 01:00:00,0514010211,Long Lick Creek-Salt River,226.2
03297845,"FLOYDS FORK NEAR CRESTWOOD, KY",38.29868,-85.42663,NAD83,,0,,,1,1987-09-24 00:00:00,1991-09-30 23:30:00,0514010208,Upper Floyds Fork,445.12
03297900,"FLOYDS FORK NEAR PEWEE VALLEY, KY",38.285347,-85.46746,NAD83,598.9,1,2007-10-01 01:00:00,2024-04-03 01:00:00,1,1991-10-01 01:00:00,2024-04-03 01:00:00,0514010208,Upper Floyds Fork,445.12
03298000,"FLOYDS FORK AT FISHERVILLE, KY",38.1884,-85.460236,NAD83,542.04,1,2007-10-01 01:00:00,2024-04-03 01:00:00,1,1987-10-01 00:30:00,2024-04-03 01:00:00,0514010208,Upper Floyds Fork,445.12
03298135,"CHENOWETH RUN AT RUCKRIEGAL PARKWAY, KY",38.19479,-85.55718,NAD83,593.74,1,2007-10-01 01:00:00,2024-04-03 01:00:00,1,1996-01-23 00:00:00,2024-04-03 01:00:00,0514010210,Lower Floyds Fork,290.4
03298150,"CHENOWETH RUN AT GELHAUS LANE NEAR FERN CREEK, KY",38.16007,-85.54218,NAD83,532.66,1,2007-10-01 01:00:00,2024-04-03 01:00:00,1,1996-01-25 00:05:00,2024-04-03 01:00:00,0514010210,Lower Floyds Fork,290.4
03298200,"FLOYDS FORK NEAR MT WASHINGTON, KY",38.085342,-85.554955,NAD83,456.84,1,2007-10-01 01:00:00,2024-04-03 01:00:00,1,2001-10-04 00:00:00,2024-04-03 01:00:00,0514010210,Lower Floyds Fork,290.4
03298242,"CEDAR CREEK AT FAIRMOUNT RD NR MT WASHINGTON, KY",38.122845,-85.42801,NAD83,,0,,,1,1992-12-19 00:00:00,1998-09-30 23:55:00,0514010209,Plum Creek-Salt River,270.66
03298250,"CEDAR CREEK AT THIXTON ROAD NEAR LOUISVILLE, KY",38.07923,-85.616066,NAD83,549.4,1,2007-10-01 01:00:00,2024-04-03 01:00:00,1,2007-10-01 01:00:00,2024-04-03 01:00:00,0514010210,Lower Floyds Fork,290.4
03298300,PENNSLYVANIA RUN AT MT WASHINGTON RD NR LOUISVILLE,38.087566,-85.642456,NAD83,522.7,1,2007-10-01 01:00:00,2024-04-03 01:00:00,1,1998-10-07 00:00:00,2024-04-03 01:00:00,0514010210,Lower Floyds Fork,290.4
03298470,"FLOYDS FORK NEAR SHEPHERDSVILLE, KY",38.0034,-85.68218,NAD83,406.11,1,2007-10-01 01:00:00,2024-04-03 01:00:00,0,,,0514010210,Lower Floyds Fork,290.4
03298500,"SALT RIVER AT SHEPHERDSVILLE, KY",37.985065,-85.71746,NAD83,406.11,1,2007-10-01 01:00:00,2024-04-03 01:00:00,1,1987-02-21 00:00:00,2024-04-03 01:00:00,0514010211,Long Lick Creek-Salt River,226.2
03298550,"LONG LICK AT CLERMONT, KY",37.92784,-85.65357,NAD83,461.84,1,2007-10-01 01:00:00,2024-04-03 01:00:00,1,1992-04-01 00:00:00,2024-04-03 01:00:00,0514010211,Long Lick Creek-Salt River,226.2
03298940,"ROLLING FORK AT HWY 208 AT CALVARY, KY",37.5125,-85.26111,NAD83,605.38,1,2021-08-19 16:00:00,2024-04-03 01:00:00,1,2021-08-19 16:00:00,2024-04-03 01:00:00,0514010304,Upper Rolling Fork,619.24
03299000,"ROLLING FORK NEAR LEBANON, KY",37.497288,-85.32385,NAD83,580.74,0,,,1,1987-10-01 01:00:00,1992-09-30 23:00:00,0514010304,Upper Rolling Fork,619.24
03299500,"ROLLING FORK AT NEW HAVEN, KY",37.649506,-85.59746,NAD83,438.85,1,2016-09-09 12:15:00,2024-04-03 01:00:00,1,2016-09-09 21:00:00,2024-04-03 01:00:00,0514010305,Middle Rolling Fork,797.71
03300400,"BEECH FORK AT MAUD, KY",37.83284,-85.29607,NAD83,529.52,1,2007-10-01 01:00:00,2024-04-03 01:00:00,1,1987-10-01 01:00:00,2024-04-03 01:00:00,0514010303,Lower Beech Fork,822.37
03301000,"BEECH FORK AT BARDSTOWN, KY",37.797005,-85.48079,NAD83,438.66,1,2007-10-01 01:00:00,2024-04-03 01:00:00,1,1997-11-08 00:00:00,2024-04-03 01:00:00,0514010303,Lower Beech Fork,822.37
03301500,"ROLLING FORK NEAR BOSTON, KY",37.767284,-85.70385,NAD83,400.04,1,2007-10-01 04:00:00,2024-04-03 01:00:00,1,1989-12-25 01:00:00,2024-04-03 01:00:00,0514010306,Lower Rolling Fork,388.32
03301630,"ROLLING FORK NEAR LEBANON JUNCTION, KY",37.82284,-85.747734,NAD83,384.42,1,2007-10-01 01:00:00,2024-04-03 01:00:00,0,,,0514010306,Lower Rolling Fork,388.32
03301700,"MILL CREEK NEAR FORT KNOX, KY",37.8834,-85.914406,NAD83,,0,,,1,1998-05-01 00:00:00,2010-09-30 23:45:00,0514010213,Mill Creek-Salt River,222.95
03301900,"FERN CREEK AT OLD BARDSTOWN RD AT LOUISVILLE, KY",38.175625,-85.615234,NAD83,550.25,1,2007-10-01 01:00:00,2024-04-03 01:00:00,1,1997-09-18 00:00:00,2024-04-03 01:00:00,0514010212,Pond Creek,327.19
03301940,"NORTHERN DITCH AT OKOLONA, KY",38.150345,-85.69357,NAD83,447.0,1,2008-01-03 15:00:00,2024-04-03 01:00:00,1,1993-10-01 00:05:00,2024-04-03 01:00:00,0514010212,Pond Creek,327.19
03302000,"POND CREEK NEAR LOUISVILLE, KY",38.119793,-85.7958,NAD83,429.76,1,2007-10-01 01:00:00,2024-04-03 01:00:00,1,1990-10-01 00:00:00,2024-04-03 01:00:00,0514010212,Pond Creek,327.19
03302030,"POND CREEK AT PENDLETON ROAD NEAR LOUISVILLE, KY",38.054237,-85.87163,NAD83,404.22,1,2007-10-01 01:00:00,2024-04-03 01:00:00,1,1998-12-05 00:00:00,2024-04-03 01:00:00,0514010212,Pond Creek,327.19
03302050,"BRIER CREEK AT PENDELTON ROAD NEAR LOUISVILLE, KY",38.046932,-85.85727,NAD83,436.66,1,2007-10-01 01:00:00,2024-04-03 01:00:00,1,1999-01-01 00:00:00,2024-04-03 01:00:00,0514010212,Pond Creek,327.19
03302058,"Salt River at Main Range Rd nr West Point, KY",37.99222,-85.92206,NAD83,,1,2023-03-15 14:45:00,2024-04-03 01:00:00,0,,,0514010213,Mill Creek-Salt River,222.95
03302060,"SALT RIVER AT MOUTH AT WEST POINT, KY",38.001183,-85.942184,NAD83,373.7,1,2021-08-13 08:45:00,2023-10-05 13:30:00,0,,,0514010213,Mill Creek-Salt River,222.95
03302110,OTTER CREEK AT OTTER CR PARK NEAR ROCK HAVEN KY.,37.923405,-86.03052,NAD83,,0,,,1,1999-01-01 00:00:00,2010-09-30 23:45:00,0514010401,Otter Creek-Ohio River,553.82
03303205,"SINKING CREEK NEAR LODIBURG, KY",37.868397,-86.38776,NAD83,,0,,,1,2004-05-28 00:00:00,2007-04-30 23:45:00,0514010413,Sinking Creek,620.43
03303280,"OHIO RIVER AT CANNELTON DAM AT CANNELTON, IN",37.8995,-86.70554,NAD83,346.98,1,2007-10-01 01:00:00,2024-04-03 00:00:00,1,2015-10-01 02:00:00,2024-04-03 00:00:00,0514020102,Clover Creek-Ohio River,420.31
03303502,"OHIO RIVER AT RIVERPORT AT OWENSBORO, KY",37.79361,-87.14161,NAD83,337.96,1,2022-10-20 09:45:00,2024-04-03 00:00:00,0,,,0514020112,Caney Creek-Ohio River,274.13
03304300,"OHIO RIVER AT NEWBURGH LOCK AND DAM, IN",37.92838,-87.37501,NAD83,329.2,1,2014-10-02 14:00:00,2024-04-03 00:00:00,0,,,0514020112,Caney Creek-Ohio River,274.13
03305000,"GREEN RIVER NEAR MCKINNEY, KY",37.42202,-84.75022,NAD83,893.12,1,2010-09-28 12:15:00,2024-04-03 01:00:00,1,2010-09-28 12:15:00,2024-04-03 01:00:00,0511000101,South Fork Green River-Green River,1015.14
03305990,"GREEN RIVER LAKE NEAR CAMPBELLSVILLE, KY",37.24784,-85.339966,NAD83,,1,2023-12-05 00:00:00,2024-04-03 01:00:00,0,,,0511000103,Casey Creek-Green River,439.54
03306000,"GREEN RIVER NEAR CAMPBELLSVILLE, KY",37.24034,-85.34718,NAD83,499.55,1,2007-10-01 01:00:00,2024-04-03 01:00:00,1,1986-10-10 00:00:00,1994-09-30 23:00:00,0511000103,Casey Creek-Green River,439.54
03306500,"GREEN RIVER AT GREENSBURG, KY",37.25367,-85.50302,NAD83,531.24,1,2007-10-01 01:00:00,2024-04-03 00:00:00,1,2004-10-01 00:00:00,2008-09-30 23:45:00,0511000107,Big Brush Creek-Green River,598.93
03307000,"RUSSELL CREEK NEAR COLUMBIA, KY",37.125477,-85.404076,NAD83,604.72,1,2007-10-01 01:00:00,2024-04-03 00:00:00,1,1986-05-30 00:00:00,2024-04-03 00:00:00,0511000104,Russell Creek,749.35
03307260,"LITTLE PITMAN CREEK NEAR CAMPBELLSVILLE, KY",37.347286,-85.39024,NAD83,,0,,,1,1990-08-10 00:00:00,1995-10-05 23:45:00,0511000105,Big Pitman Creek,350.92
03308500,"GREEN RIVER AT MUNFORDVILLE, KY",37.269444,-85.888054,NAD83,451.27,1,2007-10-01 01:00:00,2024-04-03 00:00:00,1,1986-03-29 00:00:00,2024-04-03 00:00:00,0511000108,Ugly Creek-Green River,937.69
03309000,"GREEN RIVER AT MAMMOTH CAVE, KY",37.18005,-86.11247,NAD83,409.35,1,2017-11-14 14:15:00,2024-04-03 00:00:00,1,2017-11-14 14:15:00,2024-04-03 00:00:00,0511000113,Beaverdam Creek-Green River,470.13
03310000,"NORTH FORK NOLIN RIVER AT HODGENVILLE, KY",37.578056,-85.75361,NAD83,693.0,1,2010-09-10 12:45:00,2024-04-03 01:00:00,1,2010-09-10 12:45:00,2024-04-03 01:00:00,0511000109,Upper Nolin River,265.35
03310300,"NOLIN RIVER AT WHITE MILLS, KY",37.562004,-86.03664,NAD83,589.68,1,2007-10-01 01:00:00,2024-04-03 01:00:00,1,1987-10-01 01:00:00,2024-04-03 01:00:00,0511000110,Middle Nolin River,952.89
03310400,"BACON CREEK NEAR PRICEVILLE, KY",37.351944,-85.96611,NAD83,580.39,1,2010-09-09 17:45:00,2024-04-03 00:00:00,1,1987-10-01 00:30:00,2024-04-03 00:00:00,0511000111,Lower Nolin River,662.44
03310900,"NOLIN LAKE NEAR KYROCK, KY",37.27838,-86.247475,NAD83,,1,2023-12-05 00:00:00,2024-04-03 00:00:00,0,,,0511000111,Lower Nolin River,662.44
03311000,"NOLIN RIVER AT KYROCK, KY",37.274216,-86.25081,NAD83,399.61,1,2007-10-01 01:00:00,2024-04-03 00:00:00,0,,,0511000111,Lower Nolin River,662.44
03311500,"GREEN RIVER AT LOCK 6 AT BROWNSVILLE, KY",37.206993,-86.261086,NAD83,413.03,1,2007-10-01 01:00:00,2017-03-27 12:45:00,1,1986-09-30 00:00:00,1992-09-30 23:00:00,0511000113,Beaverdam Creek-Green River,470.13
03311505,"GREEN RIVER AT WATER PLANT AT BROWNSVILLE, KY",37.20323,-86.25959,NAD83,383.17,1,2017-03-30 14:00:00,2024-04-03 00:00:00,0,,,0511000113,Beaverdam Creek-Green River,470.13
03311600,"BEAVERDAM CREEK AT RHODA, KY",37.15505,-86.226364,NAD83,513.81,0,,,1,1987-10-01 00:15:00,1994-09-30 23:45:00,0511000113,Beaverdam Creek-Green River,470.13
03312765,"BEAVER CREEK AT HWY 31 E NEAR GLASGOW, KY",37.034775,-85.90359,NAD83,,0,,,1,1991-09-01 00:00:00,2002-09-30 23:30:00,0511000203,Skaggs Creek,808.07
03312900,"BARREN RIVER LAKE NEAR FINNEY, KY",36.89199,-86.12415,NAD83,500.0,1,2023-12-05 00:00:00,2024-04-03 00:00:00,0,,,0511000204,Bays Fork-Barren River,389.53
03313000,"BARREN RIVER NEAR FINNEY, KY",36.895046,-86.13387,NAD83,399.35,1,2007-10-01 01:00:00,2024-04-03 00:00:00,1,1987-03-06 00:00:00,1994-09-30 23:00:00,0511000204,Bays Fork-Barren River,389.53
03313700,"WEST FORK DRAKES CREEK NEAR FRANKLIN, KY",36.723373,-86.552216,NAD83,581.73,1,2007-10-01 01:00:00,2024-04-03 00:00:00,1,1988-10-01 01:00:00,2024-04-03 00:00:00,0511000206,Drakes Creek,947.23
03314000,"DRAKES CREEK NEAR ALVATON, KY",36.89532,-86.38055,NAD83,441.6,1,2007-10-01 01:00:00,2024-04-03 00:00:00,1,2009-10-01 00:00:00,2024-04-03 00:00:00,0511000206,Drakes Creek,947.23
03314500,"BARREN RIVER AT BOWLING GREEN, KY",37.00282,-86.43277,NAD83,409.16,1,2007-10-05 00:00:00,2024-04-03 00:00:00,1,1987-10-01 01:00:00,2024-04-03 00:00:00,0511000209,Little Muddy Creek-Barren River,561.14
03315500,"GREEN RIVER AT LOCK 4 AT WOODBURY, KY",37.182266,-86.62999,NAD83,378.72,1,2007-10-01 01:00:00,2024-04-03 00:00:00,1,1987-10-01 00:30:00,1992-09-30 23:30:00,0511000303,Indian Camp Creek-Green River,676.93
03315850,"GREEN RIVER AT ROCHESTER, KY",37.215668,-86.893555,NAD83,351.97,1,2021-12-15 16:45:00,2024-04-03 00:00:00,0,,,0511000303,Indian Camp Creek-Green River,676.93
03316275,"MUD RIVER NEAR HUNTSVILLE, KY",37.12338,-86.90055,NAD83,,0,,,1,1991-10-31 00:00:00,1994-09-30 23:30:00,0511000302,Mud River,966.92
03316500,"GREEN RIVER AT PARADISE, KY",37.26393,-86.977776,NAD83,362.79,1,2007-10-01 01:00:00,2024-04-03 00:00:00,1,1991-07-04 00:00:00,2024-04-03 00:00:00,0511000305,Lewis Creek-Green River,424.2
03316645,"GREEN RIVER AT ROCKPORT, KY",37.335323,-87.00277,NAD83,362.79,1,2007-10-01 01:00:00,2024-04-03 00:00:00,0,,,0511000305,Lewis Creek-Green River,424.2
03318005,"ROUGH RIVER LAKE NEAR FALLS OF ROUGH, KY",37.620056,-86.49943,NAD83,,1,2023-12-05 00:00:00,2024-04-03 00:00:00,0,,,0511000403,Spring Fork-Rough River,546.95
03318010,"ROUGH RIVER NEAR FALLS OF ROUGH AT DAM, KY",37.622,-86.50415,NAD83,399.55,1,2016-10-01 01:00:00,2024-04-03 00:00:00,0,,,0511000403,Spring Fork-Rough River,546.95
03318800,"CANEY CREEK NEAR HORSE BRANCH, KY",37.46394,-86.65554,NAD83,415.77,1,2010-09-09 12:00:00,2024-04-03 00:00:00,1,1987-10-01 01:00:00,2024-04-03 00:00:00,0511000404,Caney Creek-Rough River,652.74
03319000,"ROUGH RIVER NEAR DUNDEE, KY",37.54755,-86.72166,NAD83,392.84,1,2007-10-01 01:00:00,2024-04-03 00:00:00,1,1987-01-01 00:30:00,2004-09-30 23:00:00,0511000404,Caney Creek-Rough River,652.74
03319600,"ROUGH RIVER AT HARTFORD, KY",37.453102,-86.91083,NAD83,351.57,1,2018-12-17 12:15:00,2024-04-03 00:00:00,1,2018-12-17 13:00:00,2024-04-03 00:00:00,0511000405,Muddy Creek-Rough River,664.76
03319885,"GREEN RIVER AT LIVERMORE, KY",37.485603,-87.13638,NAD83,359.77,1,2007-10-01 01:00:00,2024-04-03 00:00:00,0,,,0511000502,Long Falls Creek-Green River,398.27
03320000,"GREEN RIVER AT LOCK 2 AT CALHOUN, KY",37.533936,-87.263885,NAD83,353.62,1,2007-10-01 01:00:00,2024-04-03 00:00:00,1,1987-02-06 02:00:00,2024-04-03 00:00:00,0511000502,Long Falls Creek-Green River,398.27
03320500,"POND RIVER NEAR APEX, KY",37.122265,-87.31944,NAD83,384.4,1,2007-10-07 00:00:00,2024-04-03 00:00:00,1,1987-10-23 00:00:00,2024-04-03 00:00:00,0511000602,Buck Fork Pond River-Pond River,565.63
03321210,"CYPRESS CREEK NEAR CALHOUN, KY",37.488934,-87.28611,NAD83,,0,,,1,1990-03-07 00:00:00,1994-09-30 23:45:00,0511000604,Cypress Creek,391.35
03321350,"SOUTH FORK PANTHER CREEK NEAR WHITESVILLE, KY",37.61894,-86.88749,NAD83,399.64,1,2011-09-09 11:15:00,2024-04-03 00:00:00,1,2011-09-10 00:00:00,2024-04-03 00:00:00,0511000503,Panther Creek,972.28
03321500,"GREEN RIVER AT LOCK 1 AT SPOTTSVILLE, KY",37.858376,-87.40973,NAD83,339.56,1,2013-08-10 00:00:00,2024-04-03 00:00:00,1,2013-08-10 00:00:00,2024-04-03 00:00:00,0511000505,Race Creek-Green River,412.52
03322000,"OHIO RIVER AT EVANSVILLE, IN",37.972263,-87.5764,NAD83,328.32,1,2014-10-02 16:45:00,2024-04-03 00:00:00,0,,,0514020204,Canoe Creek-Ohio River,470.31
03322190,"OHIO RIVER AT HENDERSON, KY",37.845596,-87.59224,NAD83,329.47,1,2014-10-02 15:45:00,2024-04-03 00:00:00,0,,,0514020204,Canoe Creek-Ohio River,470.31
03322360,"BEAVERDAM CREEK NEAR CORYDON, KY",37.70393,-87.69779,NAD83,,0,,,1,1988-02-20 00:00:00,1994-09-30 23:45:00,0514020205,Upper Highland Creek,387.02
03322420,"OHIO RIVER AT UNIONTOWN DAM, KY",37.797157,-87.99834,NAD83,310.95,1,2014-10-02 11:45:00,2024-04-03 00:00:00,0,,,0514020207,Lower Highland Creek-Ohio River,453.74
03381700,"OHIO RIVER AT OLD SHAWNEETOWN, IL-KY",37.6925,-88.13472,NAD83,309.1,1,2007-10-01 00:00:00,2024-04-02 23:00:00,1,2002-01-31 00:00:00,2024-04-02 23:00:00,0514020301,Goose Pond Ditch-Ohio River,167.89
03383000,"TRADEWATER RIVER AT OLNEY, KY",37.223934,-87.78056,NAD83,361.45,1,2007-10-01 01:00:00,2024-04-03 00:00:00,1,1987-10-28 00:00:00,2024-04-03 00:00:00,0514020503,Middle Tradewater River,806.58
03384100,"TRADEWATER RIVER NEAR PROVIDENCE, KY",37.396713,-87.84502,NAD83,322.17,1,2008-10-01 01:00:00,2024-04-03 00:00:00,1,2008-10-01 01:00:00,2024-04-03 00:00:00,0514020503,Middle Tradewater River,806.58
03384500,"OHIO RIVER AT DAM 51 AT GOLCONDA, IL",37.35783,-88.482544,NAD83,293.84,1,2014-10-02 08:45:00,2024-04-02 23:00:00,0,,,0514020307,Big Grand Pierre Creek-Ohio River,290.13
03399800,"OHIO RIVER AT SMITHLAND DAM, SMITHLAND, KY",37.15922,-88.42726,NAD83,289.09,1,2007-10-01 01:00:00,2024-04-03 00:00:00,1,2007-12-16 00:00:00,2024-04-03 00:00:00,0514020309,Barren Creek-Ohio River,332.16
03400500,"POOR FORK AT CUMBERLAND, KY",36.97398,-82.99294,NAD83,1409.72,1,2009-06-30 12:00:00,2024-04-03 01:00:00,1,2009-06-30 12:00:00,2024-04-03 01:00:00,0513010101,Poor Fork Cumberland River-Martins Fork Cumberland River,962.73
03400785,"MARTINS FORK ABOVE SMITH, KY",36.7262,-83.28796,NAD83,1351.19,1,2015-03-24 15:00:00,2024-04-03 01:00:00,1,2015-02-13 16:00:00,2024-04-03 01:00:00,0513010101,Poor Fork Cumberland River-Martins Fork Cumberland River,962.73
03400798,"MARTINS FORK LK AT MARTINS FK DAM NR SMITH, KY",36.749252,-83.25768,NAD83,1292.13,1,2017-07-15 12:00:00,2024-04-03 01:00:00,0,,,0513010101,Poor Fork Cumberland River-Martins Fork Cumberland River,962.73
03400800,"MARTINS FORK NEAR SMITH, KY",36.752308,-83.2574,NAD83,1258.47,1,2015-01-26 00:00:00,2024-04-03 01:00:00,1,2014-12-24 00:00:00,2024-04-03 01:00:00,0513010101,Poor Fork Cumberland River-Martins Fork Cumberland River,962.73
03400986,"MARTIN'S FORK NEAR HARLAN, KY",36.844532,-83.32352,NAD83,1099.27,1,2011-09-09 07:00:00,2024-04-03 01:00:00,1,2012-10-23 14:00:00,2024-04-03 01:00:00,0513010101,Poor Fork Cumberland River-Martins Fork Cumberland River,962.73
03401000,"CUMBERLAND RIVER NEAR HARLAN, KY",36.846756,-83.355736,NAD83,1138.58,1,2007-10-01 01:00:00,2024-04-03 01:00:00,1,1986-06-06 00:00:00,2024-04-03 01:00:00,0513010102,Yellow Creek-Cumberland River,790.42
03401428,"BENNETTS FORK AT MIDDLESBORO, KY",36.60175,-83.75159,NAD83,,0,,,1,1987-10-01 00:15:00,1989-09-30 23:45:00,0513010102,Yellow Creek-Cumberland River,790.42
03401450,"STONY FORK NEAR MOUTH AT MIDDLESBORO, KY",36.61425,-83.75325,NAD83,,0,,,1,1987-10-01 00:15:00,1989-08-22 23:45:00,0513010102,Yellow Creek-Cumberland River,790.42
03402900,"CUMBERLAND R AT PINE ST BR AT PINEVILLE, KY",36.76314,-83.691864,NAD83,969.53,1,2013-09-19 08:00:00,2024-04-03 01:00:00,0,,,0513010103,Straight Creek-Cumberland River,964.85
03403500,"CUMBERLAND RIVER AT BARBOURVILLE, KY",36.86231,-83.88743,NAD83,942.49,1,2012-10-24 08:45:00,2024-04-03 01:00:00,1,1984-03-17 01:00:00,2005-09-30 23:30:00,0513010103,Straight Creek-Cumberland River,964.85
03403910,"CLEAR FORK AT SAXTON, KY",36.633972,-84.111595,NAD83,921.43,1,2010-06-30 06:30:00,2024-04-03 01:00:00,1,1975-02-09 00:00:00,2024-04-03 01:00:00,0513010106,Clear Fork,654.24
03404000,"CUMBERLAND RIVER AT WILLIAMSBURG, KY",36.743416,-84.156044,NAD83,891.02,1,2007-10-01 01:00:00,2024-04-03 01:00:00,1,1973-03-15 01:00:00,2024-04-03 01:00:00,0513010107,Jellico Creek-Cumberland River,611.97
03404500,"CUMBERLAND RIVER AT CUMBERLAND FALLS, KY",36.837303,-84.34327,NAD83,824.71,1,2010-10-01 00:00:00,2024-04-03 01:00:00,1,2010-10-01 00:00:00,2024-04-03 01:00:00,0513010109,Marsh Creek-Cumberland River,538.09
03404820,"LAUREL RIVER AT MUNICIPAL DAM NEAR CORBIN, KY",36.970364,-84.11965,NAD83,999.57,1,2013-11-13 13:00:00,2024-04-03 01:00:00,0,,,0513010108,Laurel River,749.32
03404900,"LYNN CAMP CREEK AT CORBIN, KY",36.951477,-84.093544,NAD83,1048.48,1,2010-06-30 06:30:00,2024-04-03 01:00:00,1,1986-07-02 00:00:00,2024-04-03 01:00:00,0513010108,Laurel River,749.32
03406500,"ROCKCASTLE RIVER AT BILLOWS, KY",37.171196,-84.29604,NAD83,802.68,1,2008-10-01 00:00:00,2024-04-03 01:00:00,1,1987-10-01 00:00:00,2024-04-03 01:00:00,0513010205,Sinking Creek-Rockcastle River,468.37
03407500,"BUCK CREEK NEAR SHOPVILLE, KY",37.210636,-84.464386,NAD83,831.05,1,2012-07-17 14:00:00,2024-04-03 01:00:00,1,2012-07-17 14:00:00,2024-04-03 01:00:00,0513010301,Buck Creek,762.36
03410500,"SOUTH FORK CUMBERLAND RIVER NEAR STEARNS, KY",36.62702,-84.53327,NAD83,765.36,1,2009-06-30 12:00:00,2024-04-03 01:00:00,1,1984-03-31 01:00:00,2023-12-09 14:30:00,0513010405,Roaring Paunch Creek-Big South Fork Cumberland River,817.81
03410590,"ROCK CREEK NEAR YAMACRAW, KY",36.702778,-84.56306,NAD83,737.58,1,2015-08-04 09:45:00,2020-09-29 13:15:00,1,2015-08-04 10:00:00,2020-09-29 13:15:00,0513010405,Roaring Paunch Creek-Big South Fork Cumberland River,817.81
03410600,"SOUTH FORK CUMBERLAND RIVER NEAR YAMACRAW, KY",36.72563,-84.54383,NAD83,,0,,,1,2002-10-01 00:00:00,2004-09-30 23:00:00,0513010407,Sinking Creek-Big South Fork Cumberland River,471.63
03413200,"BEAVER CREEK NEAR MONTICELLO, KY",36.79757,-84.89606,NAD83,805.12,1,2007-10-01 01:00:00,2024-04-03 01:00:00,1,1989-10-02 01:00:00,2024-04-03 01:00:00,0513010305,Beaver Creek,612.44
03414000,"CUMBERLAND RIVER NEAR ROWENA, KY",36.883953,-85.139404,NAD83,540.08,1,2020-12-08 00:00:00,2024-04-03 00:00:00,0,,,0513010306,Crocus Creek-Cumberland River,836.08
03414078,"CROCUS CREEK NEAR AMANDAVILLE, KY",36.887028,-85.330284,NAD83,547.98,1,2018-04-20 11:00:00,2024-04-03 00:00:00,1,2018-04-20 13:30:00,2024-04-03 00:00:00,0513010306,Crocus Creek-Cumberland River,836.08
03414100,"CUMBERLAND RIVER AT BURKESVILLE, KY",36.786728,-85.36524,NAD83,499.61,1,2013-11-08 08:00:00,2024-04-03 00:00:00,1,2014-06-25 00:00:00,2024-04-03 00:00:00,0513010307,Marrowbone Creek-Cumberland River,979.59
03414170,"MARROWBONE CK AT MUD CAMP RD AT WATERVIEW, KY",36.81514,-85.45883,NAD83,546.91,1,2021-12-28 13:45:00,2024-04-03 00:00:00,0,,,0513010307,Marrowbone Creek-Cumberland River,979.59
03435105,"RED RIVER AT DOT, KY",36.67666,-86.95209,NAD83,457.67,1,2016-09-16 10:15:00,2024-04-03 00:00:00,1,2016-09-16 10:15:00,2024-04-03 00:00:00,0513020602,South Fork Red River-Red River,699.51
03437370,"N FK LITTLE R AT WATER PLANT AT HOPKINSVILLE, KY",36.876156,-87.471954,NAD83,510.0,1,2014-11-14 11:30:00,2024-04-03 00:00:00,0,,,0513020505,Upper Little River,696.48
03437480,"S FK LITTLE RIVER AT HWY 68/80 NR HOPKINSVILLE, KY",36.849766,-87.35223,NAD83,550.64,1,2009-10-01 01:00:00,2024-04-03 00:00:00,1,2009-10-01 01:00:00,2024-04-03 00:00:00,0513020505,Upper Little River,696.48
03437495,"S FK LITTLE R AT HWY 68 BY-PASS AT HOPKINSVILLE,KY",36.84949,-87.428894,NAD83,520.0,1,2009-10-01 01:00:00,2024-04-03 00:00:00,1,2009-10-01 01:00:00,2024-04-03 00:00:00,0513020505,Upper Little River,696.48
03437500,"SOUTH FORK LITTLE RIVER AT HOPKINSVILLE, KY",36.83949,-87.4814,NAD83,499.5,1,2012-10-01 01:00:00,2024-04-03 00:00:00,0,,,0513020505,Upper Little River,696.48
03610000,"CLARKS RIVER AT MURRAY, KY",36.592834,-88.30004,NAD83,459.73,1,2011-09-15 11:15:00,2024-04-03 00:00:00,1,2011-09-15 11:15:00,2024-04-03 00:00:00,0604000601,Upper Clarks River,438.68
03610200,"CLARKS RIVER AT ALMO, KY",36.691723,-88.27364,NAD83,413.35,1,2007-10-01 01:00:00,2024-04-03 00:00:00,1,1987-10-01 00:30:00,2024-04-03 00:00:00,0604000601,Upper Clarks River,438.68
03610545,"WEST FORK CLARKS RIVER NEAR BREWERS, KY",36.780056,-88.467545,NAD83,370.05,0,,,1,1988-12-12 14:00:00,1994-10-01 00:00:00,0604000602,Upper West Fork Clarks River,309.19
03611000,"OHIO RIVER AT PADUCAH, KY",37.0895,-88.59449,NAD83,285.46,1,2014-08-18 13:30:00,2024-04-03 00:00:00,0,,,0514020601,Mud Creek-Ohio River,260.41
03611260,"MASSAC CREEK NEAR PADUCAH, KY",37.041443,-88.710884,NAD83,344.78,1,2007-10-01 01:00:00,2024-04-03 00:00:00,1,1987-10-01 00:15:00,2024-04-03 00:00:00,0514020603,Massac Creek,197.06
03611500,"OHIO RIVER AT METROPOLIS, IL",37.147552,-88.74089,NAD83,276.18,0,,,1,2007-09-30 23:00:00,2010-06-19 22:45:00,0514020607,Redstone Creek-Ohio River,514.2
03611800,"BAYOU CREEK NEAR HEATH, KY",37.089775,-88.82978,NAD83,,0,,,1,1990-10-01 00:00:00,2010-09-30 23:45:00,0514020607,Redstone Creek-Ohio River,514.2
03611850,"BAYOU CREEK NEAR GRAHAMVILLE, KY",37.144775,-88.82728,NAD83,,0,,,1,1990-10-17 00:00:00,2010-10-07 10:00:00,0514020607,Redstone Creek-Ohio River,514.2
